{
  "schemaVersion": "observations/v1",
  "source": "authored",
  "scanConfigurationDigest": "b50a01ef0091d03b1455602518a7cfd739d919b234e0020c73f9f8f3bf7382fb",
  "repository": {
    "repositoryId": "archie",
    "remoteUrl": "https://github.com/Entorn-dev/archie",
    "revision": "ff47bd2954a6505fc41b624751eb8b39266e3133",
    "isDirty": false,
    "contentDigest": "94b692a06491ce114f2671e46a6f612cc55efb37db4e8937d2231d8656e120a5"
  },
  "scanners": [],
  "observations": [
    {
      "kind": "relationship",
      "id": "edge:checkout-calls-payment",
      "evidence": {
        "id": "evidence:checkout-calls-payment",
        "claimId": "edge:checkout-calls-payment",
        "provenance": "deterministic",
        "scannerId": null,
        "scannerVersion": null,
        "extractionMethod": "authored Book Retail fixture observation (not scanner-derived)",
        "path": "tests/fixtures/observations/book-retail.authored.json",
        "range": {
          "startLine": 179,
          "startColumn": 1,
          "endLine": 179,
          "endColumn": 100
        },
        "confidence": "confirmed",
        "properties": {
          "observationSource": "authored"
        }
      },
      "relationship": "calls",
      "from": {
        "key": "deployable:checkout-service",
        "kind": "deployable",
        "explicitId": "deployable:checkout-service",
        "name": "Checkout Service",
        "resolution": "resolved",
        "identitySignals": {
          "architecture-id": "deployable:checkout-service"
        },
        "properties": {
          "description": "Accepts checkout requests and submits paid orders.",
          "environment": "current",
          "purpose": "Validate baskets, collect payment, and publish accepted orders.",
          "owner": "team:checkout",
          "glossary": [
            "checkout: converting a basket into a paid order"
          ],
          "onboarding": [
            "Read the checkout endpoint",
            "Inspect payment and publish relationships"
          ]
        }
      },
      "to": {
        "key": "external:payment-provider",
        "kind": "external-service",
        "explicitId": "external:payment-provider",
        "name": "Payment Provider",
        "resolution": "resolved",
        "identitySignals": {
          "architecture-id": "external:payment-provider"
        },
        "properties": {
          "description": "Safe local payment-provider stub.",
          "environment": "external",
          "purpose": "Authorize development payments.",
          "owner": "team:checkout",
          "glossary": [],
          "onboarding": [
            "Inspect the Checkout call boundary"
          ]
        }
      },
      "properties": {
        "label": "authorizes payment"
      }
    },
    {
      "kind": "relationship",
      "id": "edge:checkout-publishes-order-submitted",
      "evidence": {
        "id": "evidence:checkout-publishes-order-submitted",
        "claimId": "edge:checkout-publishes-order-submitted",
        "provenance": "deterministic",
        "scannerId": null,
        "scannerVersion": null,
        "extractionMethod": "authored Book Retail fixture observation (not scanner-derived)",
        "path": "tests/fixtures/observations/book-retail.authored.json",
        "range": {
          "startLine": 179,
          "startColumn": 1,
          "endLine": 179,
          "endColumn": 100
        },
        "confidence": "confirmed",
        "properties": {
          "observationSource": "authored"
        }
      },
      "relationship": "publishes",
      "from": {
        "key": "deployable:checkout-service",
        "kind": "deployable",
        "explicitId": "deployable:checkout-service",
        "name": "Checkout Service",
        "resolution": "resolved",
        "identitySignals": {
          "architecture-id": "deployable:checkout-service"
        },
        "properties": {
          "description": "Accepts checkout requests and submits paid orders.",
          "environment": "current",
          "purpose": "Validate baskets, collect payment, and publish accepted orders.",
          "owner": "team:checkout",
          "glossary": [
            "checkout: converting a basket into a paid order"
          ],
          "onboarding": [
            "Read the checkout endpoint",
            "Inspect payment and publish relationships"
          ]
        }
      },
      "to": {
        "key": "channel:order-submitted",
        "kind": "message-channel",
        "explicitId": "channel:order-submitted",
        "name": "order.submitted",
        "resolution": "resolved",
        "identitySignals": {
          "architecture-id": "channel:order-submitted"
        },
        "properties": {
          "description": "Carries accepted orders into asynchronous processing.",
          "environment": "current",
          "purpose": "Begin durable order processing after checkout.",
          "owner": "team:ordering",
          "glossary": [
            "submitted order: payment accepted, awaiting processing"
          ],
          "onboarding": [
            "Inspect publisher evidence",
            "Follow Ordering Service"
          ]
        }
      },
      "properties": {
        "label": "publishes order.submitted"
      }
    },
    {
      "kind": "relationship",
      "id": "edge:inventory-subscribes-reservation",
      "evidence": {
        "id": "evidence:inventory-subscribes-reservation",
        "claimId": "edge:inventory-subscribes-reservation",
        "provenance": "deterministic",
        "scannerId": null,
        "scannerVersion": null,
        "extractionMethod": "authored Book Retail fixture observation (not scanner-derived)",
        "path": "tests/fixtures/observations/book-retail.authored.json",
        "range": {
          "startLine": 181,
          "startColumn": 1,
          "endLine": 181,
          "endColumn": 100
        },
        "confidence": "confirmed",
        "properties": {
          "observationSource": "authored"
        }
      },
      "relationship": "subscribes",
      "from": {
        "key": "deployable:inventory-worker",
        "kind": "deployable",
        "explicitId": "deployable:inventory-worker",
        "name": "Inventory Worker",
        "resolution": "resolved",
        "identitySignals": {
          "architecture-id": "deployable:inventory-worker"
        },
        "properties": {
          "description": "Reserves stock for accepted orders.",
          "environment": "current",
          "purpose": "Consume reservation requests and persist stock state.",
          "owner": "team:inventory",
          "glossary": [],
          "onboarding": [
            "Follow the reservation subscription"
          ]
        }
      },
      "to": {
        "key": "channel:inventory-reservation",
        "kind": "message-channel",
        "explicitId": "channel:inventory-reservation",
        "name": "inventory.reservation-requested",
        "resolution": "resolved",
        "identitySignals": {
          "architecture-id": "channel:inventory-reservation"
        },
        "properties": {
          "description": "Requests stock reservation.",
          "environment": "current",
          "purpose": "Decouple order coordination from stock writes.",
          "owner": "team:inventory",
          "glossary": [
            "reservation: held stock for a paid order"
          ],
          "onboarding": [
            "Inspect the inventory worker"
          ]
        }
      },
      "properties": {
        "label": "subscribes to inventory reservation"
      }
    },
    {
      "kind": "relationship",
      "id": "edge:inventory-writes-database",
      "evidence": {
        "id": "evidence:inventory-writes-database",
        "claimId": "edge:inventory-writes-database",
        "provenance": "deterministic",
        "scannerId": null,
        "scannerVersion": null,
        "extractionMethod": "authored Book Retail fixture observation (not scanner-derived)",
        "path": "tests/fixtures/observations/book-retail.authored.json",
        "range": {
          "startLine": 181,
          "startColumn": 1,
          "endLine": 181,
          "endColumn": 100
        },
        "confidence": "confirmed",
        "properties": {
          "observationSource": "authored"
        }
      },
      "relationship": "writes-to",
      "from": {
        "key": "deployable:inventory-worker",
        "kind": "deployable",
        "explicitId": "deployable:inventory-worker",
        "name": "Inventory Worker",
        "resolution": "resolved",
        "identitySignals": {
          "architecture-id": "deployable:inventory-worker"
        },
        "properties": {
          "description": "Reserves stock for accepted orders.",
          "environment": "current",
          "purpose": "Consume reservation requests and persist stock state.",
          "owner": "team:inventory",
          "glossary": [],
          "onboarding": [
            "Follow the reservation subscription"
          ]
        }
      },
      "to": {
        "key": "database:inventory",
        "kind": "database",
        "explicitId": "database:inventory",
        "name": "Inventory database",
        "resolution": "resolved",
        "identitySignals": {
          "architecture-id": "database:inventory"
        },
        "properties": {
          "description": "Stores current stock reservations.",
          "environment": "current",
          "purpose": "Persist reservation state.",
          "owner": "team:inventory",
          "glossary": [],
          "onboarding": [
            "Review writes from Inventory Worker"
          ]
        }
      },
      "properties": {
        "label": "writes reservations"
      }
    },
    {
      "kind": "relationship",
      "id": "edge:legacy-publishes-dispatch",
      "evidence": {
        "id": "evidence:legacy-publishes-dispatch",
        "claimId": "edge:legacy-publishes-dispatch",